<?xml version="1.0" encoding="UTF-8"?>
<!DOCTYPE translation SYSTEM "../../../Blue_Reflection_Text_Tool/translation_fr.dtd">
<translation game="blue_reflection" lang="fr">
    <meta release="Blue Reflection French Translation 8 1.1 2026-08-21T07-02Z YUzj5sMpX" generated_utc="2026-10-14T01:48:14Z" />
    <places>
        <string string_no="2228225">Ecole</string>
        <string string_no="2228226">Maison</string>
        <string string_no="2228227">Evénement</string>
        <string string_no="2228228">Common central</string>
        <string string_no="2228229">Zone de joie</string>
        <string string_no="2228230">Zone de peur</string>
        <string string_no="2228231">Zone de tristesse</string>
        <string string_no="2228232">Zone de colere</string>
        <string string_no="2228233">Zone de joie et de peur</string>
        <string string_no="2228234">Zone de peur et de tristesse</string>
        <string string_no="2228235">Zone de tristesse et de colere</string>
        <string string_no="2228236">Zone de colere et de joie</string>
        <string string_no="3735553" />
        <string string_no="3735554" />
        <string string_no="3735555" />
        <string string_no="3735556" />
        <string string_no="3735557" />
        <string string_no="3735558" />
        <string string_no="3735559" />
        <string string_no="3735560" />
        <string string_no="3735561" />
        <string string_no="3735562" />
        <string string_no="3735563" />
        <string string_no="3735564" />
        <string string_no="3735565" />
        <string string_no="3735566" />
        <string string_no="3735567" />
        <string string_no="3735568" />
        <string string_no="3735569" />
        <string string_no="3735570" />
        <string string_no="3735571" />
        <string string_no="3735572" />
        <string string_no="3735573" />
        <string string_no="3735574" />
        <string string_no="3735575" />
        <string string_no="3735576" />
        <string string_no="3735577" />
        <string string_no="3735578" />
        <string string_no="3735579" />
        <string string_no="3735580" />
        <string string_no="3735581" />
        <string string_no="3735582" />
        <string string_no="3735583" />
        <string string_no="3735584" />
        <string string_no="3735585" />
        <string string_no="3735586" />
        <string string_no="3735587" />
        <string string_no="3735588" />
        <string string_no="3735589" />
        <string string_no="3735590" />
        <string string_no="3735591" />
        <string string_no="3735592" />
        <string string_no="4980737">Batiment scolaire</string>
        <string string_no="4980738">Toit</string>
        <string string_no="4980739">Toit</string>
        <string string_no="4980740">Local du club de sciences</string>
        <string string_no="4980741">3e étage</string>
        <string string_no="4980742">Couloir du 3e étage</string>
        <string string_no="4980743">Local du conseil des éleves</string>
        <string string_no="4980744">Local du comité du festival</string>
        <string string_no="4980745">3-A</string>
        <string string_no="4980746">3-B</string>
        <string string_no="4980747">2e étage</string>
        <string string_no="4980748">Couloir du 2e étage</string>
        <string string_no="4980749">Bibliotheque</string>
        <string string_no="4980750">Salle des auteurs</string>
        <string string_no="4980751">2-A</string>
        <string string_no="4980752">2-B</string>
        <string string_no="4980753">1er étage</string>
        <string string_no="4980754">Couloir du 1er étage</string>
        <string string_no="4980755">Supérette du lycée</string>
        <string string_no="4980756">1-A</string>
        <string string_no="4980757">1-B</string>
        <string string_no="4980758">Infirmerie</string>
        <string string_no="4980759">Installation</string>
        <string string_no="4980760">Entrée principale</string>
        <string string_no="4980761">Cour</string>
        <string string_no="4980762">Terrain</string>
        <string string_no="4980763">Salon d'essai</string>
        <string string_no="4980764">Autre</string>
        <string string_no="4980765">Accueil</string>
        <string string_no="5046273">Se déplacer dans l'établissement</string>
        <string string_no="5046274">Aller sur le toit</string>
        <string string_no="5046275">Aller sur le toit</string>
        <string string_no="5046276">Aller au local du club de sciences</string>
        <string string_no="5046277">Aller au 3e étage</string>
        <string string_no="5046278">Aller dans le couloir du 3e étage</string>
        <string string_no="5046279">Aller au local du conseil des éleves</string>
        <string string_no="5046280">Aller au local du comité du festival</string>
        <string string_no="5046281">Aller en classe normale 3-A</string>
        <string string_no="5046282">Aller en classe spéciale 3-B</string>
        <string string_no="5046283">Aller au 2e étage</string>
        <string string_no="5046284">Aller dans le couloir du 2e étage</string>
        <string string_no="5046285">Aller a la bibliotheque</string>
        <string string_no="5046286">Aller dans la salle des auteurs</string>
        <string string_no="5046287">Aller en classe normale 2-A</string>
        <string string_no="5046288">Aller en classe spéciale 2-B</string>
        <string string_no="5046289">Aller au 1er étage</string>
        <string string_no="5046290">Aller dans le couloir du 1er étage</string>
        <string string_no="5046291">Aller a la supérette du lycée</string>
        <string string_no="5046292">Aller en classe normale 1-A</string>
        <string string_no="5046293">Aller en classe spéciale 1-B</string>
        <string string_no="5046294">Aller a l'infirmerie</string>
        <string string_no="5046295">Aller vers une installation du lycée</string>
        <string string_no="5046296">Aller a l'entrée principale</string>
        <string string_no="5046297">Aller dans la cour</string>
        <string string_no="5046298">Aller sur le terrain</string>
        <string string_no="5046299">Menu de changement de tenues</string>
        <string string_no="5046300">Sortir de l'établissement</string>
        <string string_no="5046301">Rentrer chez soi</string>
    </places>
</translation>
