<?xml version="1.0" encoding="UTF-8"?>
<!DOCTYPE translation SYSTEM "../../../Blue_Reflection_Text_Tool/translation_fr.dtd">
<translation game="second_light" lang="fr"><meta release="BRSL beta dialogue + machine translation" /><dialogue><chapter id="zz00"><event file="event_en/zz00/event_message_zz00_010.ebm"><message msg_id="4294967295" name_id="4294967295">徃纃宁</message></event><event file="event_en/zz00/event_message_zz00_020.ebm"><message msg_id="4294967295" name_id="4294967295">徃纃宁</message></event><event file="event_en/zz00/event_message_zz00_030.ebm"><message msg_id="4294967295" name_id="4294967295">徃纃宁</message></event><event file="event_en/zz00/event_message_zz00_040.ebm"><message msg_id="4294967295" name_id="4294967295">徃纃宁</message></event><event file="event_en/zz00/event_message_zz00_050.ebm"><message msg_id="4294967295" name_id="4294967295">徃纃宁</message></event><event file="event_en/zz00/event_message_zz00_060.ebm"><message msg_id="4294967295" name_id="4294967295">徃纃宁</message></event><event file="event_en/zz00/event_message_zz00_070.ebm"><message msg_id="4294967295" name_id="4294967295">徃纃宁</message></event><event file="event_en/zz00/event_message_zz00_080.ebm"><message msg_id="4294967295" name_id="4294967295">徃纃宁</message></event><event file="event_en/zz00/event_message_zz00_090.ebm"><message msg_id="4294967295" name_id="4294967295">徃纃宁</message></event><event file="event_en/zz00/event_message_zz00_100.ebm"><message msg_id="0" name_id="0">Ordre du jour 1&lt;CR&gt;A propos de la structure</message><message msg_id="1" name_id="3">La structure qui se trouvait dans mon Heartscape...&lt;CR&gt;Je pense toujours que c'est la clé.</message><message msg_id="2" name_id="3">Qu'en avez-vous toutes pensé ?</message><message msg_id="3" name_id="0">La structure a été placée la par une mystérieuse tierce partie&lt;CR&gt;comme indice pour sauver Oasis.</message></event><event file="event_en/zz00/event_message_zz00_110.ebm"><message msg_id="4294967295" name_id="4294967295">徃纃宁</message></event><event file="event_en/zz00/event_message_zz00_120.ebm"><message msg_id="4294967295" name_id="4294967295">徃纃宁</message></event><event file="event_en/zz00/event_message_zz00_130.ebm"><message msg_id="4294967295" name_id="4294967295">徃纃宁</message></event><event file="event_en/zz00/event_message_zz00_140.ebm"><message msg_id="4294967295" name_id="4294967295">徃纃宁</message></event><event file="event_en/zz00/event_message_zz00_150.ebm"><message msg_id="4294967295" name_id="4294967295">徃纃宁</message></event><event file="event_en/zz00/event_message_zz00_160.ebm"><message msg_id="4294967295" name_id="4294967295">徃纃宁</message></event><event file="event_en/zz00/event_message_zz00_170.ebm"><message msg_id="4294967295" name_id="4294967295">徃纃宁</message></event><event file="event_en/zz00/event_message_zz00_180.ebm"><message msg_id="4294967295" name_id="4294967295">徃纃宁</message></event><event file="event_en/zz00/event_message_zz00_190.ebm"><message msg_id="4294967295" name_id="4294967295">徃纃宁</message></event><event file="event_en/zz00/event_message_zz00_200.ebm"><message msg_id="4294967295" name_id="4294967295">徃纃宁</message></event><event file="event_en/zz00/event_message_zz00_210.ebm"><message msg_id="4294967295" name_id="4294967295">徃纃宁</message></event><event file="event_en/zz00/event_message_zz00_220.ebm"><message msg_id="4294967295" name_id="4294967295">徃纃宁</message></event><event file="event_en/zz00/event_message_zz00_230.ebm"><message msg_id="4294967295" name_id="4294967295">徃纃宁</message></event><event file="event_en/zz00/event_message_zz00_240.ebm"><message msg_id="4294967295" name_id="4294967295">徃纃宁</message></event><event file="event_en/zz00/event_message_zz00_250.ebm"><message msg_id="4294967295" name_id="4294967295">徃纃宁</message></event><event file="event_en/zz00/event_message_zz00_260.ebm"><message msg_id="4294967295" name_id="4294967295">徃纃宁</message></event><event file="event_en/zz00/event_message_zz00_270.ebm"><message msg_id="4294967295" name_id="4294967295">徃纃宁</message></event><event file="event_en/zz00/event_message_zz00_280.ebm"><message msg_id="4294967295" name_id="4294967295">徃纃宁</message></event><event file="event_en/zz00/event_message_zz00_290.ebm"><message msg_id="4294967295" name_id="4294967295">徃纃宁</message></event><event file="event_en/zz00/event_message_zz00_300.ebm"><message msg_id="4294967295" name_id="4294967295">徃纃宁</message></event><event file="event_en/zz00/event_message_zz00_310.ebm"><message msg_id="4294967295" name_id="4294967295">徃纃宁</message></event><event file="event_en/zz00/event_message_zz00_320.ebm"><message msg_id="4294967295" name_id="4294967295">徃纃宁</message></event><event file="event_en/zz00/event_message_zz00_330.ebm"><message msg_id="4294967295" name_id="4294967295">徃纃宁</message></event><event file="event_en/zz00/event_message_zz00_340.ebm"><message msg_id="4294967295" name_id="4294967295">徃纃宁</message></event><event file="event_en/zz00/event_message_zz00_350.ebm"><message msg_id="4294967295" name_id="4294967295">徃纃宁</message></event><event file="event_en/zz00/event_message_zz00_360.ebm"><message msg_id="4294967295" name_id="4294967295">徃纃宁</message></event><event file="event_en/zz00/event_message_zz00_370.ebm"><message msg_id="4294967295" name_id="4294967295">徃纃宁</message></event><event file="event_en/zz00/event_message_zz00_380.ebm"><message msg_id="4294967295" name_id="4294967295">徃纃宁</message></event><event file="event_en/zz00/event_message_zz00_390.ebm"><message msg_id="4294967295" name_id="4294967295">徃纃宁</message></event><event file="event_en/zz00/event_message_zz00_400.ebm"><message msg_id="4294967295" name_id="4294967295">徃纃宁</message></event><event file="event_en/zz00/event_message_zz00_410.ebm"><message msg_id="4294967295" name_id="4294967295">徃纃宁</message></event><event file="event_en/zz00/event_message_zz00_420.ebm"><message msg_id="4294967295" name_id="4294967295">徃纃宁</message></event><event file="event_en/zz00/event_message_zz00_430.ebm"><message msg_id="4294967295" name_id="4294967295">徃纃宁</message></event><event file="event_en/zz00/event_message_zz00_440.ebm"><message msg_id="4294967295" name_id="4294967295">徃纃宁</message></event><event file="event_en/zz00/event_message_zz00_450.ebm"><message msg_id="4294967295" name_id="4294967295">徃纃宁</message></event><event file="event_en/zz00/event_message_zz00_460.ebm"><message msg_id="4294967295" name_id="4294967295">徃纃宁</message></event><event file="event_en/zz00/event_message_zz00_470.ebm"><message msg_id="4294967295" name_id="4294967295">徃纃宁</message></event><event file="event_en/zz00/event_message_zz00_480.ebm"><message msg_id="4294967295" name_id="4294967295">徃纃宁</message></event><event file="event_en/zz00/event_message_zz00_490.ebm"><message msg_id="4294967295" name_id="4294967295">徃纃宁</message></event><event file="event_en/zz00/event_message_zz00_500.ebm"><message msg_id="4294967295" name_id="4294967295">徃纃宁</message></event></chapter></dialogue></translation>