<?xml version="1.0" encoding="UTF-8"?>
<!DOCTYPE translation SYSTEM "../../../Blue_Reflection_Text_Tool/translation_fr.dtd">
<translation game="second_light" lang="fr"><meta release="BRSL beta system text (mojibake fixed) + machine translation for gaps" /><places><string string_no="2228236">Coeurite d’Ao</string><string string_no="2228237">Route vers l’Origine</string><string string_no="2228227">Coeurite de Shiho</string><string string_no="2228231">Coeurite de Kirara</string><string string_no="2228234">Coeurite de Yuzu et Lime</string><string string_no="2228228">Coeurite d’Uta</string><string string_no="2228229">Coeurite de Hinako</string><string string_no="2228226">Le Forlointain</string><string string_no="2228233">Coeurite de Yuki</string><string string_no="2228238" /><string string_no="2228241">Ile lointaine</string><string string_no="2228242">Coeurite de Ryza</string><string string_no="2228232">Coeurite des s. Hirahara</string><string string_no="2228240" /><string string_no="2228230">Coeurite de Rena</string><string string_no="2228243">Coeurite inconnue</string><string string_no="2228244" /><string string_no="2228235" /><string string_no="2228225">Ecole</string><string string_no="2228245" /><string string_no="2228239">Coeurite de Kokoro</string></places></translation>